04879,Commentary-(Flash) Tum Jo Mil Gaye Ho
04880,Commentary-Hits (Flashes) Of 1974-Nos 32-31
04881,Commentary-Ruk Jana Nahin
04882,Commentary-Ulfut Mein Zamane Ki
04883,Commentary-Nainon Mein Darpan Hai
04884,Commentary-Hits (Flashes) Nos 30 To 26
04885,Commentary-Zindagi Ke Safar Mein
04886,Commentary-Apne Dil Mein Jagah Dijiye
04887,Commentary-Diye Jalte Hai Phool Khilte Hai
04888,Commentary-Hits (Flashes) Nos 25 To 19
04889,Commentary-Main Dhoondhta Hoon Jinko
04890,Commentary-Mitwa More Man Mitwa
04891,Commentary-Hum Bolega To Bologe Ki Bolta Hai
04892,Commentary-Hits (Flashes) Nos 18 To 12
